{
 "$schema": "https://sustainableurbansystems.com/CFD-Test-Cases-Architectural-Institute-of-Japan-AIJ/api/schemas/points.schema.json",
 "schema_version": "2.0.0",
 "data_version": "f09f6ec0013369f02ea137ff30f2b53f098a13a5e3952f37b57ab3db1b6f92c7",
 "license": "CC-BY-4.0",
 "case": "A",
 "title": "Case A — 1:1:2 building",
 "points_source": "clean/cases/A/points.csv",
 "units": {
  "length": "m (model scale)",
  "velocity": "m/s",
  "variance": "m^2/s^2",
  "k": "m^2/s^2"
 },
 "frame": {
  "origin": "building centre on the ground plane",
  "x": "+x streamwise (the wind at WD = 0 blows toward +x); building spans x in [-0.04, 0.04]",
  "y": "+y lateral; building spans y in [-0.04, 0.04]; points published on the y <= 0 half by the tunnel's symmetry convention",
  "z": "+z up from the ground; roof at z = 0.16",
  "lateral_sign_applied": 1,
  "coordinate_scale_applied": 1.0
 },
 "columns": [
  "point_id",
  "config",
  "instrument",
  "wind_direction_deg",
  "x",
  "y",
  "z",
  "U",
  "V",
  "W",
  "uu",
  "vv",
  "ww",
  "k"
 ],
 "column_meaning": {
  "point_id": "the tunnel's own measurement point number",
  "config": "configuration key: 'default', Case C centre building '0D'/'1D'/'2D', Case E state 'bc' (before) / 'ac' (after construction)",
  "instrument": "'split_fibre' (vector components) or 'thermistor' (omnidirectional scalar speed)",
  "wind_direction_deg": "AIJ wind direction in degrees; 0 is the case's reference direction (see frame)",
  "x": "m, case frame",
  "y": "m, case frame",
  "z": "m above ground, case frame",
  "U": "m/s, mean velocity along +x",
  "V": "m/s, mean velocity along +y (sign unified: positive toward +y)",
  "W": "m/s, mean velocity along +z",
  "uu": "m^2/s^2, variance of u",
  "vv": "m^2/s^2, variance of v",
  "ww": "m^2/s^2, variance of w",
  "k": "m^2/s^2, turbulent kinetic energy"
 },
 "n": 186,
 "csv": {
  "url": "https://sustainableurbansystems.com/CFD-Test-Cases-Architectural-Institute-of-Japan-AIJ/api/cases/A/points.csv?v=eb21b9a8ffd3",
  "path": "cases/A/points.csv",
  "media_type": "text/csv",
  "bytes": 17488,
  "sha256": "eb21b9a8ffd351a88d35a55ba8ef71bcc5d906a787395b91c4808b338d6d7915"
 },
 "points": [
  {
   "point_id": 1,
   "config": "default",
   "instrument": "split_fibre",
   "wind_direction_deg": 0.0,
   "x": -0.06,
   "y": 0.0,
   "z": 0.01,
   "U": 0.208,
   "V": -0.088,
   "W": -0.667,
   "uu": 0.770884,
   "vv": 0.228484,
   "ww": 0.822649,
   "k": 0.911
  },
  {
   "point_id": 2,
   "config": "default",
   "instrument": "split_fibre",
   "wind_direction_deg": 0.0,
   "x": -0.06,
   "y": 0.0,
   "z": 0.04,
   "U": 1.267,
   "V": -0.046,
   "W": -0.621,
   "uu": 0.388129,
   "vv": 0.283024,
   "ww": 0.338724,
   "k": 0.505
  },
  {
   "point_id": 3,
   "config": "default",
   "instrument": "split_fibre",
   "wind_direction_deg": 0.0,
   "x": -0.06,
   "y": 0.0,
   "z": 0.08,
   "U": 1.409,
   "V": -0.042,
   "W": -0.291,
   "uu": 0.363609,
   "vv": 0.335241,
   "ww": 0.3844,
   "k": 0.542
  },
  {
   "point_id": 4,
   "config": "default",
   "instrument": "split_fibre",
   "wind_direction_deg": 0.0,
   "x": -0.06,
   "y": 0.0,
   "z": 0.12,
   "U": 1.701,
   "V": 0.022,
   "W": 0.328,
   "uu": 0.363609,
   "vv": 0.385641,
   "ww": 0.323761,
   "k": 0.537
  },
  {
   "point_id": 5,
   "config": "default",
   "instrument": "split_fibre",
   "wind_direction_deg": 0.0,
   "x": -0.06,
   "y": 0.0,
   "z": 0.14,
   "U": 2.067,
   "V": 0.078,
   "W": 0.837,
   "uu": 0.364816,
   "vv": 0.452929,
   "ww": 0.284089,
   "k": 0.551
  },
  {
   "point_id": 6,
   "config": "default",
   "instrument": "split_fibre",
   "wind_direction_deg": 0.0,
   "x": -0.06,
   "y": 0.0,
   "z": 0.16,
   "U": 3.044,
   "V": 0.081,
   "W": 1.341,
   "uu": 0.498436,
   "vv": 0.440896,
   "ww": 0.283024,
   "k": 0.611
  },
  {
   "point_id": 7,
   "config": "default",
   "instrument": "split_fibre",
   "wind_direction_deg": 0.0,
   "x": -0.06,
   "y": 0.0,
   "z": 0.17,
   "U": 3.654,
   "V": 0.068,
   "W": 1.312,
   "uu": 0.609961,
   "vv": 0.452929,
   "ww": 0.272484,
   "k": 0.668
  },
  {
   "point_id": 8,
   "config": "default",
   "instrument": "split_fibre",
   "wind_direction_deg": 0.0,
   "x": -0.06,
   "y": 0.0,
   "z": 0.19,
   "U": 4.539,
   "V": 0.034,
   "W": 0.906,
   "uu": 0.710649,
   "vv": 0.432964,
   "ww": 0.263169,
   "k": 0.703
  },
  {
   "point_id": 9,
   "config": "default",
   "instrument": "split_fibre",
   "wind_direction_deg": 0.0,
   "x": -0.06,
   "y": 0.0,
   "z": 0.22,
   "U": 4.962,
   "V": -0.009,
   "W": 0.442,
   "uu": 0.720801,
   "vv": 0.380689,
   "ww": 0.259081,
   "k": 0.68
  },
  {
   "point_id": 10,
   "config": "default",
   "instrument": "split_fibre",
   "wind_direction_deg": 0.0,
   "x": -0.06,
   "y": 0.0,
   "z": 0.28,
   "U": 5.351,
   "V": -0.021,
   "W": 0.104,
   "uu": 0.654481,
   "vv": 0.368449,
   "ww": 0.263169,
   "k": 0.643
  },
  {
   "point_id": 11,
   "config": "default",
   "instrument": "split_fibre",
   "wind_direction_deg": 0.0,
   "x": -0.04,
   "y": 0.0,
   "z": 0.17,
   "U": 4.281,
   "V": 0.113,
   "W": 2.58,
   "uu": 0.743044,
   "vv": 0.495616,
   "ww": 0.488601,
   "k": 0.864
  },
  {
   "point_id": 12,
   "config": "default",
   "instrument": "split_fibre",
   "wind_direction_deg": 0.0,
   "x": -0.04,
   "y": 0.0,
   "z": 0.19,
   "U": 4.937,
   "V": 0.019,
   "W": 1.091,
   "uu": 0.695556,
   "vv": 0.400689,
   "ww": 0.306916,
   "k": 0.702
  },
  {
   "point_id": 13,
   "config": "default",
   "instrument": "split_fibre",
   "wind_direction_deg": 0.0,
   "x": -0.04,
   "y": 0.0,
   "z": 0.22,
   "U": 5.138,
   "V": -0.006,
   "W": 0.418,
   "uu": 0.683929,
   "vv": 0.388129,
   "ww": 0.272484,
   "k": 0.672
  },
  {
   "point_id": 14,
   "config": "default",
   "instrument": "split_fibre",
   "wind_direction_deg": 0.0,
   "x": -0.04,
   "y": 0.0,
   "z": 0.28,
   "U": 5.402,
   "V": -0.045,
   "W": 0.012,
   "uu": 0.613089,
   "vv": 0.3364,
   "ww": 0.275625,
   "k": 0.613
  },
  {
   "point_id": 15,
   "config": "default",
   "instrument": "split_fibre",
   "wind_direction_deg": 0.0,
   "x": -0.02,
   "y": 0.0,
   "z": 0.17,
   "U": 1.681,
   "V": -0.109,
   "W": 0.271,
   "uu": 5.331481,
   "vv": 0.912025,
   "ww": 0.662596,
   "k": 3.453
  },
  {
   "point_id": 16,
   "config": "default",
   "instrument": "split_fibre",
   "wind_direction_deg": 0.0,
   "x": -0.02,
   "y": 0.0,
   "z": 0.19,
   "U": 5.568,
   "V": 0.014,
   "W": 0.834,
   "uu": 0.804609,
   "vv": 0.385641,
   "ww": 0.328329,
   "k": 0.759
  },
  {
   "point_id": 17,
   "config": "default",
   "instrument": "split_fibre",
   "wind_direction_deg": 0.0,
   "x": -0.02,
   "y": 0.0,
   "z": 0.22,
   "U": 5.268,
   "V": -0.009,
   "W": 0.298,
   "uu": 0.660969,
   "vv": 0.395641,
   "ww": 0.275625,
   "k": 0.666
  },
  {
   "point_id": 18,
   "config": "default",
   "instrument": "split_fibre",
   "wind_direction_deg": 0.0,
   "x": -0.02,
   "y": 0.0,
   "z": 0.28,
   "U": 5.416,
   "V": -0.048,
   "W": -0.015,
   "uu": 0.616225,
   "vv": 0.352836,
   "ww": 0.277729,
   "k": 0.623
  },
  {
   "point_id": 19,
   "config": "default",
   "instrument": "split_fibre",
   "wind_direction_deg": 0.0,
   "x": 0.0,
   "y": 0.0,
   "z": 0.17,
   "U": 1.25,
   "V": -0.122,
   "W": -0.186,
   "uu": 3.888784,
   "vv": 1.181569,
   "ww": 1.125721,
   "k": 3.098
  },
  {
   "point_id": 20,
   "config": "default",
   "instrument": "split_fibre",
   "wind_direction_deg": 0.0,
   "x": 0.0,
   "y": 0.0,
   "z": 0.19,
   "U": 5.461,
   "V": -0.024,
   "W": 0.221,
   "uu": 1.317904,
   "vv": 0.480249,
   "ww": 0.268324,
   "k": 1.033
  },
  {
   "point_id": 21,
   "config": "default",
   "instrument": "split_fibre",
   "wind_direction_deg": 0.0,
   "x": 0.0,
   "y": 0.0,
   "z": 0.22,
   "U": 5.307,
   "V": -0.011,
   "W": 0.144,
   "uu": 0.644809,
   "vv": 0.400689,
   "ww": 0.273529,
   "k": 0.66
  },
  {
   "point_id": 22,
   "config": "default",
   "instrument": "split_fibre",
   "wind_direction_deg": 0.0,
   "x": 0.0,
   "y": 0.0,
   "z": 0.28,
   "U": 5.402,
   "V": -0.041,
   "W": -0.047,
   "uu": 0.594441,
   "vv": 0.366025,
   "ww": 0.277729,
   "k": 0.619
  },
  {
   "point_id": 23,
   "config": "default",
   "instrument": "split_fibre",
   "wind_direction_deg": 0.0,
   "x": 0.04,
   "y": 0.0,
   "z": 0.17,
   "U": 2.743,
   "V": 0.007,
   "W": -0.33,
   "uu": 2.852721,
   "vv": 1.572516,
   "ww": 0.762129,
   "k": 2.594
  },
  {
   "point_id": 24,
   "config": "default",
   "instrument": "split_fibre",
   "wind_direction_deg": 0.0,
   "x": 0.04,
   "y": 0.0,
   "z": 0.19,
   "U": 4.824,
   "V": -0.022,
   "W": -0.411,
   "uu": 1.697809,
   "vv": 0.708964,
   "ww": 0.345744,
   "k": 1.376
  },
  {
   "point_id": 25,
   "config": "default",
   "instrument": "split_fibre",
   "wind_direction_deg": 0.0,
   "x": 0.04,
   "y": 0.0,
   "z": 0.22,
   "U": 5.212,
   "V": -0.012,
   "W": -0.139,
   "uu": 0.617796,
   "vv": 0.429025,
   "ww": 0.2809,
   "k": 0.664
  },
  {
   "point_id": 26,
   "config": "default",
   "instrument": "split_fibre",
   "wind_direction_deg": 0.0,
   "x": 0.04,
   "y": 0.0,
   "z": 0.28,
   "U": 5.504,
   "V": -0.039,
   "W": -0.139,
   "uu": 0.622521,
   "vv": 0.338724,
   "ww": 0.279841,
   "k": 0.621
  },
  {
   "point_id": 27,
   "config": "default",
   "instrument": "split_fibre",
   "wind_direction_deg": 0.0,
   "x": 0.06,
   "y": 0.0,
   "z": 0.01,
   "U": -0.641,
   "V": -0.077,
   "W": 0.318,
   "uu": 0.389376,
   "vv": 0.567009,
   "ww": 0.167281,
   "k": 0.562
  },
  {
   "point_id": 28,
   "config": "default",
   "instrument": "split_fibre",
   "wind_direction_deg": 0.0,
   "x": 0.06,
   "y": 0.0,
   "z": 0.04,
   "U": -0.576,
   "V": -0.094,
   "W": 0.374,
   "uu": 0.367236,
   "vv": 0.602176,
   "ww": 0.267289,
   "k": 0.618
  },
  {
   "point_id": 29,
   "config": "default",
   "instrument": "split_fibre",
   "wind_direction_deg": 0.0,
   "x": 0.06,
   "y": 0.0,
   "z": 0.08,
   "U": -0.522,
   "V": -0.06,
   "W": 0.55,